<!--

    Copyright (c) 2006, 2018 Oracle and/or its affiliates. All rights reserved.

    This program and the accompanying materials are made available under the
    terms of the Eclipse Public License v. 2.0, which is available at
    http://www.eclipse.org/legal/epl-2.0.

    This Source Code may also be made available under the following Secondary
    Licenses when the conditions for such availability set forth in the
    Eclipse Public License v. 2.0 are satisfied: GNU General Public License,
    version 2 with the GNU Classpath Exception, which is available at
    https://www.gnu.org/software/classpath/license.html.

    SPDX-License-Identifier: EPL-2.0 OR GPL-2.0 WITH Classpath-exception-2.0

-->

<!DOCTYPE layoutDefinition SYSTEM "/jsftemplating/layout.dtd" >

<layoutDefinition>
    <layout>
    <if condition="$property{condition}">
        <!-- Loop through children -->
        <foreach key="_child" list="$attribute{_children}">
        <event type="beforeLoop">
            <handler id="getUIComponentChildren">
            <input name="parent" value="$this{component}" />
            <outputMapping outputName="children" targetType="attribute" targetKey="_children" />
            </handler>
        </event>
        <if condition="#{_child.id}">
            <!-- Add the child component -->
            <component type="staticText" id="#{_child.id}" />
        </if>
        <!-- FIXME: Log a message if _child.id == null -->
        </foreach>
    </if>
    </layout>
</layoutDefinition>
